id,title,description,price,language,url
287955,Алгебра,"Формат занятий (на выбор)
8–12 занятий по 60–80 минут.

Каждое занятие: 5–10 минут теории (алгоритм) → 30 минут решения задач с разбором → задача-вызов на дом.

Все задачи — разных уровней: от школьных до вступительных в физмат-школы.

Результат после курса
Ученик сможет:

решать текстовые задачи, в которых условие «съезжает» в дробно-рациональное уравнение;

использовать метод таблиц и схем вместо гадания;

отличать, когда нужна прямая пропорциональность, а когда — средняя скорость;

уверенно работать с пр",,ru,https://stepik.org/course/287955
287946,"""Кюй и душа: современный курс игры на домбре""","Погрузитесь в удивительный мир домбры и откройте для себя красоту казахской музыки! Уроки подойдут как для начинающих, так и для тех, кто хочет развить своё мастерство и прикоснуться к настоящему музыкальному наследию.",,ru,https://stepik.org/course/287946
287941,Практикум по Python: от простых задач к алгоритмам,"О курсе

Курс предназначен для школьников и начинающих программистов, которые хотят изучить язык программирования Python через решение практических задач.",,ru,https://stepik.org/course/287941
287938,Проектирование псих.-пед. образования с цифровыми технологиями,"Курс для обучающихся, которые хотят создавать реальные образовательные продукты на стыке психологии, педагогики и IT. Вы научитесь проектировать онлайн-курсы, тесты, словари, буклеты и сайты, работая над личностно значимой задачей. Курс построен как проект: от диагностики интересов и когнитивных способностей до публичной защиты портфолио. Вы изучите общую, социальную и возрастную психологию, нейропсихологию, основы педагогического мастерства и дистанционные технологии. ",,ru,https://stepik.org/course/287938
287925,Методический разбор учебника Н. Я. Виленкина для 5 класса,"Курс представляет собой подробный разбор тем учебника математики для 5 класса. В курсе собраны понятные объяснения теории, разборы примеров, практические задания и самостоятельные работы для закрепления материала. Обучение направлено на помощь пятиклассникам в изучении математики и подготовке к урокам, контрольным и самостоятельным работам.",,ru,https://stepik.org/course/287925
287917,Passive Voice,"Курс «Passive Voice для начинающих» — это простой и наглядный путь к освоению страдательного залога в английском языке за 6 модулей. Вы перестанете путать «is done» и «was done», научитесь строить вопросы и отрицания, а также использовать живые разговорные конструкции типа «I am interested in». Всё с примерами, тестами и мгновенной проверкой.",,en,https://stepik.org/course/287917
287903," ""Как считали в древнем Египте. Дроби, умножение без таблицы","Узнайте, как египтяне записывали числа, умножали без калькулятора и использовали аликвотные дроби. Контрольный тест внутри.",,ru,https://stepik.org/course/287903
287900,"«Present Simple: как говорить о том, что мы делаем всегда»","Цель модуля: Научиться использовать Present Simple для описания повседневных действий, фактов и расписаний.",,ru,https://stepik.org/course/287900
287898,Present Tenses ,"Разберитесь в тонкостях английских времен группы Present! Наш курс охватывает:
•  Present Simple: Привычки, факты, расписания.
•  Present Continuous: Действия в процессе, временные ситуации, планы.
•  Present Perfect: Результаты действий, опыт, события, связанные с настоящим.

Четкие объяснения, практические задания и реальные примеры помогут вам не только понять, но и активно использовать эти времена в повседневной речи.",,ru,https://stepik.org/course/287898
287896,Статистика и анализ данных в футболе с Python,"Анализируем футбол через математику и Python: распределение Пуассона, xG-модели, сети передач, диаграммы Вороного. Реальные данные АПЛ — бесплатно.",500.00,ru,https://stepik.org/course/287896
287895,Ветеринарно-санитарная экспертиза растительных продуктов,"Дисциплина направлена на формирование у обучающихся системных знаний в области ветеринарно-санитарной экспертизы растительного сырья и продовольственной продукции. В рамках курса рассматриваются правовые и нормативные основы контроля растительной продукции, методология органолептической и лабораторной оценки качества, а также вопросы химической безопасности — в первую очередь контроля содержания нитратов. Освоение курса обеспечивает готовность к самостоятельному проведению ветеринарно-санитарной экспертизы.",,ru,https://stepik.org/course/287895
287876,Всеобщая история (XIX век),"Курс посвящён изучению ключевых событий, процессов и тенденций мировой истории XIX века — эпохи масштабных перемен, индустриализации, колониальной экспансии, политических революций и формирования современных национальных государств.
Основные темы курса:
- Социально-экономическое и политическое развитие стран Европы, Америки, Азии и Африки;
- Причины и последствия революций 1830 и 1848 годов, их влияние на социальную структуру общества;
- Военная история XIX века
- Развитие культуры и науки в XIX веке",,ru,https://stepik.org/course/287876
287871,Времена глаголов для 9 классов,"Курс для 9 класса, который за 3 темы научит понимать и использовать всю группу времён Perfect. Ты разберёшься, чем Present Perfect отличается от Past Simple, зачем нужно «предпрошедшее» Past Perfect и как заглядывать в будущее с Future Perfect. Теория с понятными схемами, практика с тестами и контрольные срезы — всё, чтобы раз и навсегда навести порядок в английской грамматике.",,ru,https://stepik.org/course/287871
287870,Математические фокусы,"Курс предназначен для учеников 5–6 классов, которые хотят увидеть математику с новой стороны — увлекательной и живой. За несколько интерактивных занятий учащиеся освоят фокус «Угадай число», поймут его алгебраический секрет и научатся объяснять, почему результат всегда одинаковый. Формат курса включает короткие видео с пошаговой демонстрацией, анимацию, наглядно показывающие преобразования чисел, а также тесты для самопроверки.",,ru,https://stepik.org/course/287870
287860,"Времена группы ""Present""","Курс посвящен временам группы ""Present"" английского языка и подойдет как старшеклассникам, сдающим экзамены, так и любому другому человеку, решившему заняться самообразованием.",,ru,https://stepik.org/course/287860
287859,tenses,"Первый модуль посвящён настоящему времени в английском языке. Учащиеся изучают три ключевых времени: Present Simple (для фактов, привычек и расписания), Present Continuous (для действий прямо сейчас или временных ситуаций) и Present Perfect (для результата, опыта и незаконченных периодов). Также разбирается глагол to be во всех формах.

Каждая тема содержит структурированную теорию с таблицами, списки слов-маркеров и правила образования утвердительных, отрицательных и вопросительных предложений.
",,ru,https://stepik.org/course/287859
287857,ГЕОМЕТРИЯ ВОКРУГ НАС: ПЛОЩАДИ И ОБЪЁМЫ ФИГУР,"Геометрия в реальной жизни: площади комнат, объём аквариума, задачи на ремонт и упаковку. Короткие видео + тест. Для 7-9 классов.",,ru,https://stepik.org/course/287857
287850,Теория вероятности в жизни ,"Этот курс научит вас думать о случайностях как математик. Вы разберёте четыре классические ситуации — от парадокса с игровым шоу до оценки лотерей и медицинских тестов — и поймёте, почему наша интуиция часто ошибается. Никаких сложных формул: только логика, наглядные примеры и практические выводы. После курса вы сможете критически оценивать риски, распознавать манипуляции с цифрами и принимать более взвешенные решения в условиях неопределённости.
",,ru,https://stepik.org/course/287850
287847,Perfect Tenses (перфектные времена),"Этот курс поможет вам разобраться в трёх перфектных временах английского языка: Present Perfect, Past Perfect и Future Perfect. Вы узнаете, как говорить о действиях, которые имеют результат сейчас, произошли раньше других действий в прошлом или будут завершены к определённому моменту в будущем.",,en,https://stepik.org/course/287847
287845,География мира,"«География мира: от полюсов до экватора» — интерактивный курс для изучения нашей планеты. Вы познакомитесь с природой, климатом, странами и народами Земли. Узнаете, как устроена география и почему в разных местах мира всё по‑разному. ",,ru,https://stepik.org/course/287845
287839,English Cours ,"Это увлекательный курс, направленный на развитие базовых языковых навыков учащихся 4 класса. Программа разработана с учетом возрастных особенностей детей и включает интерактивные задания, игровые элементы и практические упражнения. ",,ru,https://stepik.org/course/287839
287837,Системы счисления,Больше никакой путаницы в цифрах: после этого курса вы будете с легкостью переводить числа и понимать принципы их представления в различных системах.,,ru,https://stepik.org/course/287837
287836,Меры поддержки студенческих семей,"Курс создан в рамках выполнения зачетного задания по учебной дисциплине ""Современные образовательные технологии"" программы магистратуры.

",,ru,https://stepik.org/course/287836
287834,Основы гиревого спорта,"Цель: Изучить гиревой спорт
Задачи:
 Познакомиться с историей гиревого спорта.
 Познакомиться с правилами гиревого спорта.
 Изучить технику гиревого спорта.

Гиревой спорт — это циклический силовой вид спорта, в основе которого лежит подъём гирь максимально возможное число раз за отведённый промежуток времени в положении стоя. ",,ru,https://stepik.org/course/287834
287832,Психологическое интервью,"Общий список вопросов для прояснения в ходе начала психологического консультирования. Ответы на эти вопросы также будут полезны при представлении случая на супервизию.
Вы можете произвольно выбрать те из них, которые необходимы для последующей диагностики и составления плана работы.",,ru,https://stepik.org/course/287832
287831,Информатика. Основы компьютерных наук,"«Основы компьютерных наук: от информации до цифровых схем» — это вводный курс, который даёт системное понимание того, как работают компьютеры на фундаментальном уровне. Вы начнёте с понятия информации и её измерения, освоите системы счисления, узнаете, как числа хранятся и обрабатываются в памяти ЭВМ, погрузитесь в логические основы цифровых устройств и изучите принципы работы базовых компонентов процессора — от простейших вентилей до сумматоров и мультиплексоров.",3000.00,ru,https://stepik.org/course/287831
287830,Как не потеряться в цифровой образовательной среде,"Цифровая образовательная среда открывает огромные возможности, но также создает риски: информационную перегрузку, трудности с самоорганизацией, потерю фокуса. Этот мини-курс научит вас работать в ЦОС эффективно и без стресса.",,ru,https://stepik.org/course/287830
287827,География ,"География как наука изучает пространственно-временные закономерности развития природно-территориальных и социально-экономических систем. Программа курса включает разделы по литологии, климатологии, гидрологии суши, геоморфологии и географии населения. Слушатели овладеют навыками составления комплексных физико-географических характеристик регионов, анализа демографической структуры и оценки природно-ресурсного потенциала территорий на основе официальных статистических данных.",,ru,https://stepik.org/course/287827
287819,СИЗ против статического электричества: современные подходы,"Курс посвящён средствам индивидуальной защиты (СИЗ), разработанным для контроля и нейтрализации статического электричества.",,ru,https://stepik.org/course/287819
287811,СДВГ у взрослых,"""У меня СДВГ"" сейчас слышно буквально отовсюду. Кажется, словно это дань моде или действительно масштабная эпидемия. На курсе разбираемся с этим вместе с клиническим психологом и нейроотличным человеком Екатериной Шацковой и врачом-психиатром Владиславом Кузнецовым",6750.00,ru,https://stepik.org/course/287811
287803,Подготовка к Golang собеседованию | Полный курс ,"Практический курс для Go-разработчиков уровня Junior/Middle. Готовит к техническому интервью с нуля до оффера. Внутри: 350+ вопросов с разборами, 100+ задач на написание кода, 20 задач на Code Review и 75 тестовых заданий для самопроверки с объяснением. Покрывает все ключевые темы: основы языка, конкурентность и синхронизация, базы данных, инфраструктура, алгоритмы, архитектура и протоколы. Отдельные блоки по Soft Skills и зарплатным вилкам.",,ru,https://stepik.org/course/287803
287802,Александр 3 Миротворец,История жизни ИМператора Российской Империи Александра 3  жизнь до восхода на престол основные реформы  военные союз и болезнь и смерть,,ru,https://stepik.org/course/287802
287801,English for designers for Figma,"Figma English for Designers — это практический курс английского языка для начинающих UI/UX и product-дизайнеров, работающих в Figma.Курс помогает научиться уверенно общаться и работать в международной дизайн-среде: отвечать на feedback, объяснять интерфейсы и взаимодействовать с разработчиками и клиентами на английском языке.",,ru,https://stepik.org/course/287801
287797,Экологическая безопасность в общехозяйственном управлении,Повышение теоретических знаний и навыков руководителей и специалистов по вопросам экологической безопасности в организации или на предприятии,6000.00,ru,https://stepik.org/course/287797
287792,Способы формирования УУД у школьников,"Курс «Способы формирования универсальных учебных действий у школьников»

Цель: Ознакомить педагогов с методами формирования универсальных учебных действий (УУД).

Результаты: Участники получат знания о формировании УУД, научатся применять методы, разработают стратегии и смогут оценивать уровень их сформированности.",,ru,https://stepik.org/course/287792
287790,Система уверенности: Научный подход к мужской харизме,"Уверенность — это не врожденный дар и не «маска» из пикап-школ. Это навык, который тренируется так же, как мышцы в зале. Этот курс — системный инженерный подход к вашей личности. Мы не будем использовать «аффирмации» или «секреты миллиардеров». Только доказательная психология (КПТ, ACT), нейробиология и конкретные протоколы действий. 4 уровня работы: мышление, тело, эмоции и социальные навыки. Постройте фундамент, на который вы сможете опереться в любой ситуации.",500.00,ru,https://stepik.org/course/287790
287787,Continuous Tenses (длительные времена),"Этот курс поможет вам разобраться в трёх длительных временах английского языка: Present Continuous, Past Continuous и Future Continuous. Вы узнаете, как говорить о действиях, которые происходят прямо сейчас, длились в прошлом в определённый момент или будут длиться в будущем.",,ru,https://stepik.org/course/287787
287785,Методики раннего развития: от Монтессори до реджио-педагогике ,"предназначен для педагогов дошкольного образования, студентов педагогических специальностей и родителей, интересующихся осознанным развитием детей от 0 до 7 лет. В курсе рассматриваются пять ключевых педагогических систем, их философские основания, практические инструменты и критерии выбора под конкретные задачи.",,ru,https://stepik.org/course/287785
