id,title,description,price,language,url
288486,Подготовка к ОГЭ. Задание 10. Перевод систем счисления,"После прохождения курса вы будете уверенно решать задание № 10 на ОГЭ, затрачивая минимум времени и допуская минимум ошибок. 

",,ru,https://stepik.org/course/288486
288485,Звуки и буквы. Согласные звуки.," «Русский язык, 3 класс: увлекательное путешествие в мир слов и звуков»
Цель курса: систематизировать и углубить знания учащихся по русскому языку в соответствии с ФГОС, развить грамотность, языковое чутьё и интерес к изучению родного языка.
Для кого: для учеников 3 класса, их родителей и учителей. Подходит для:
регулярной поддержки школьного обучения;
восполнения пробелов в знаниях;
самостоятельной работы и домашней практики;
подготовки к контрольным работам.

",,ru,https://stepik.org/course/288485
288452,Дизайн-мышление в управлении качеством,"Курс направлен на формирование компетенций в области дизайн-мышления применительно к управлению качеством. Структура включает четыре модуля, последовательно реализующих этапы методологии: эмпатия (глубинные интервью, карта эмпатии, техника «5 почему»), фокусировка (карта стейкхолдеров, формирование проектной задачи POV), генерация идей (SCAMPER, «шесть шляп мышления», синектика, метод Уолта Диснея), прототипирование и тестирование. По каждому модулю предусмотрены практические упражнения. ",,ru,https://stepik.org/course/288452
288448,Как объяснить подростку английскую грамматику. Средняя школа 11+,"Рабочая тетрадь-справочник для печати + материалы. Как родителю помочь подростку 11–15 лет разобраться в английской грамматике без скандалов и скуки. 27 уроков по всем темам средней школы: артикли, времена (включая Perfect и Continuous), пассивный залог, conditionals, косвенная речь. Готовые схемы, карточки, квизы и эстафеты – чтобы подросток сам захотел заполнять справочник.",3000.00,ru,https://stepik.org/course/288448
288447,Как объяснить ребёнку английскую грамматику. Начальная школа 7+,"Пошаговая инструкция для родителей: как объяснить ребёнку 7–10 лет английскую грамматику и создать с ним личный справочник. 27 готовых уроков (алфавит, артикли, времена, модальные глаголы), схемы для рисования, карточки, игры и чек-листы. Никакой зубрёжки – только творчество и понятные правила.",3000.00,ru,https://stepik.org/course/288447
288431,«Твои права в интернете»,"Вы боитесь, что мошенники украдут ваши деньги? Не знаете, что делать, если взломали аккаунт в соцсетях? Переживаете, что ваши фото кто-то использует без спроса? Хотите понять, за какие репосты и комментарии могут оштрафовать? Тогда этот курс создан именно для вас.

Курс «Твои права в интернете» — это практическое руководство по безопасному и законному поведению в цифровом мире. Мы не учим вас быть юристами. Мы учим вас быть грамотными, защищёнными и уверенными пользователями интернета. 

",,ru,https://stepik.org/course/288431
288429,Цветотренинг. Часть 0.,Курс представляет собой тренировочную площадку по распознаванию цвета. В этой части вы научитесь различать 24 цвета.,,ru,https://stepik.org/course/288429
288416,"Python deque: очереди, стеки и буферы","Курс про collections.deque в Python: двустороннюю очередь для быстрых операций с левым и правым краем. Разберём создание deque, FIFO-очереди, LIFO-стек, append, appendleft, pop, popleft, extendleft, maxlen, rotate, отличия от list, частые ошибки и практические задачи на очереди, буферы и алгоритмы.",599.00,ru,https://stepik.org/course/288416
288398,Эффективная работа в Excel,"Курс создан для тех, кто хочет быстро освоить практические навыки работы в Microsoft Excel и применять их для решения повседневных задач — от учёта личных финансов до подготовки отчётов и анализа данных.",,ru,https://stepik.org/course/288398
288394,«ТЕХНОЛОГИЧЕСКИЕ ПРОЦЕССЫ АВТОМАТИЗИРОВАННЫХ ПРОИЗВОДСТВ» ,"1.	Назначение процесса и виды теплоносителей
2.	Классификация и конструкция теплообменников
3.	Типовые конструкции теплообменников
4.	Маркировка и совершенство конструкции
",,ru,https://stepik.org/course/288394
288386,"Время ДВФУ: управляй учебой, а не она тобой","Курс направлен на развитие у студентов навыков самоорганизации, продуктивности и эффективного обучения. В процессе обучения участники познакомятся с  методами планирования времени, научатся бороться с прокрастинацией, выстраивать систему полезных привычек и грамотно работать с учебной информацией.

Курс помогает студентам не только повысить успеваемость, но и снизить уровень стресса, научиться распределять нагрузку и сохранять баланс между учебой, отдыхом и личной жизнью.",,ru,https://stepik.org/course/288386
288385,«Средневековая архитектура Западной Европы: романика и готика».,"4 урока (2 модуля) по 30 минут каждый. Вы научитесь отличать романский стиль от готического по трём деталям, разбираться в конструкции соборов и узнавать 6 главных памятников Европы. Для всех, кто хочет «читать» архитектуру как открытую книгу.",,ru,https://stepik.org/course/288385
288379,токсоплазмоз,Что нужно знать о токсоплазмозе: от заражения до профилактики. Кому угрожает опасность и как вовремя распознать болезнь.,,ru,https://stepik.org/course/288379
288374,"Рекрутинг: Инструменты найма, скрининг и скрипты общения.","Научитесь строить воронку найма, скринить резюме за 30 секунд и писать письма кандидатам по готовым шаблонам. Всё без видео и без привязки к дорогим ATS. 3 модуля, PDF-шаблоны, практика.",1500.00,ru,https://stepik.org/course/288374
288372,Психология мышления: как научиться понимать свой мозг,Курс посвящен изучению психологии мышления для непрофессионалов. Основное фокус курса – практическое применение знаний из этой области в реальной жизни. ,,ru,https://stepik.org/course/288372
288365,И.А. Крылов. «Ворона и Лисица»,"Вы не просто запомните содержание басни «Ворона и Лисица», но и научитесь думать, анализировать поступки героев, отличать лесть от правды, сопереживать и работать с информацией в разных форматах (текст, видео, аудио, тесты, творчество). А ещё — станете чуть ближе к великой русской литературе и её мудрости.",,ru,https://stepik.org/course/288365
288362,Запусти AI-продукт за 30 дней,"Практический курс для тех, кто хочет за 30 дней выбрать идею AI-продукта, собрать лендинг или MVP, запустить первые касания и проверить спрос через заявки, созвоны или первые оплаты.",,ru,https://stepik.org/course/288362
288361,«История Франции для ЕГЭ: все нужные темы за 4 недели»,"Подготовка к ЕГЭ по истории Франции: даты, события, личности и аргументы (задание №21). 4 недели, 4 блока, 15 часов. Для 10-11 классов.",,ru,https://stepik.org/course/288361
288358,Интернет-маркетинг,"Интернет‑маркетинг позволяет бизнесу быть заметным онлайн, выстраивать долгосрочные отношения с клиентами и увеличивать прибыль. Эффективность достигается за счёт комплексного использования инструментов и постоянного анализа данных.",250.00,ru,https://stepik.org/course/288358
288357,Налоговый комплаенс,"Курс раскрывает понятие и систему комплаенса, управление налоговыми рисками и комплаенс-культуру в организации. Рассматриваются принципы налогового комплаенса, модели налогового контроля ФНС, риск-ориентированный подход, паспорта рисков. Изучается правовое регулирование комплаенса в РФ (Базельские принципы, COSO, ИНТОСАИ), поведенческие и экономические факторы налогового поведения, алгоритмы создания системы tax compliance. Отдельный блок посвящён международному обмену информацией: FATCA, CRS, ответственнос",,ru,https://stepik.org/course/288357
288356,Новый язык моей жизни,"Практический курс о том, как заменить ранящие слова на бережные и перестать разрушать близкие отношения на ровном месте. 90 пар фраз, 10 категорий деструктивной речи, 14 дней практики — и новый способ говорить с партнёром, детьми и коллегами. Без абстрактных советов «будьте добрее» — только конкретные фразы на замену. Научная основа — типология ранящих сообщений профессора коммуникации Аниты Ванджелисти.",1750.00,ru,https://stepik.org/course/288356
288349,Добрая теория вероятностей (для ЕГЭ),"Цель курса — дать твёрдую базу по теории вероятностей для уверенного решения экзаменационных задач. Акцент делается не на заучивании формул, а на понимании сути явлений и логики расчётов. Он построен так, чтобы вы не просто выучили алгоритмы, а действительно разобрались в теории вероятностей — отсюда и название «Добрая теория вероятностей».",,ru,https://stepik.org/course/288349
288348,Курс по географии,"Курс из модулей, которые закроют самые важные темы школьной географии: материки-гиганты, океанские глубины, самые длинные реки и высочайшие горы, уникальные озёра, а также политическую карту мира — столицы, крупнейшие страны и государства без выхода к морю. В конце каждого модуля — контрольные вопросы, в конце курса — итоговый тест. Подходит для быстрого повторения или введения в предмет.",,ru,https://stepik.org/course/288348
288347,Решение задач с развёрнутым ответом в ЕГЭ по географии,"В этом курсе решаются задания с развёрнутым ответом в ЕГЭ по географии. Здесь Вам покажут, как легко получить больше 10 баллов.",,ru,https://stepik.org/course/288347
288340,Планета в деталях,"Курс «Планета в деталях» — это увлекательное путешествие по устройству нашей планеты для школьников и всех, кто интересуется естественными науками. Он даёт целостное представление о Земле как единой системе взаимосвязанных оболочек и процессов.

Цель курса: сформировать у слушателей комплексное понимание устройства планеты, взаимосвязей природных процессов и роли человека в экосистеме Земли.",,ru,https://stepik.org/course/288340
288338,География „Сдам ЕГЭ сам“,"сформировать целостное представление о географической картине мира, взаимосвязи природы, населения и хозяйства, а также развить навыки работы с географическими источниками информации (картами, статистикой, ГИС).",,ru,https://stepik.org/course/288338
288337,Prompt-инжиниринг для начинающих,"Подведение итогов. Инструкция по созданию комплексного промпта-инструкции для решения повседневной задачи студента (например, планировщик тренировок, генератор постов, ИИ-репетитор английского). Пару слов об этике и аhttps://stepik.org/course/288337/infoвторских правах.",,ru,https://stepik.org/course/288337
288336,Python для начинающих.,"Практический курс Python для начинающих: 10 модулей с теорией и автоматическими задачами. Изучите переменные, циклы, списки, словари, функции, файлы, обработку ошибок. Финальный проект — консольный To-Do лист с сохранением данных. Подходит для полного нуля. Каждый урок сопровождается задачей для закрепления. Итоговый тест и сертификат.»",,ru,https://stepik.org/course/288336
288331,курс для крутых девчонок,"ооочень крутой курс для очень крутых девчонок.
научит быть крутой и классной малышкой шалунишкой озорнишкой",,ru,https://stepik.org/course/288331
288317,Сочинение ЕГЭ,"Курс «Сочинение ЕГЭ» создан для моих учеников с целью отработки написания сочинения. Здесь будут различные практики, которые помогут улучшить баллы. ",,ru,https://stepik.org/course/288317
288313,Основы проектной деятельности,"Предлагаемый курс ""Основы проектной деятельности"" позволит обучающимся на основе полученных знаний без труда создать свой проект. 
Проектная деятельность — это то, с чем сталкивается любой сотрудник, предприниматель или  участник стартапа, но не всегда у участников проекта есть четкое понимание ролей, методов и инструментов проектной деятельности, отличия управления проектом от управления продуктом. Данный курс восполняет эти пробелы, выстраивая четкое понимание предмета проектной деятельности.",,ru,https://stepik.org/course/288313
288312,Создание авторской хореографии,"Курс для тех, кто хочет создавать свои уникальные танцевальные номера, раскрывать творческий потенциал!",,ru,https://stepik.org/course/288312
288308,Компьютерная графика ,"В формате микрообучения вы ознакомитесь с теоретическими основами компьютерной графики, узнаете, как развивалась компьютерная графика.",,ru,https://stepik.org/course/288308
288305,Преобразование графиков функций.,"От линейных функций до параболы и гиперболы -- школьники часто запоминают графики механически, не понимая их ""характер"". Этот курс -- мост между скучными формулами и живой геометрией. Мы научимся видеть, как двигать, сжимать и отражать графики.",,ru,https://stepik.org/course/288305
288301,"""Основны информационных технологий для начинающих""",Цель курса: дать слушателям фундаментальные знания в области информационных технологий и практические навыки работы с основными программами и сервисами для решения повседневных и учебных задач.,,ru,https://stepik.org/course/288301
288297,Математика 3 класс. 12 Урок. Таблица умножения и деления на 4. ,"🦉 Стань повелителем таблицы умножения! Игры, видео-загадки и творческие задания помогут выучить таблицу на 4 легко и весело. Присоединяйся к Совёнку Умнику!",,ru,https://stepik.org/course/288297
288295,Связь между величинами,"В этой теме изучаются три взаимосвязанные величины. Первая — масса одного предмета (сколько весит одна штука: одно яблоко, один пакет, одна коробка). Вторая — количество предметов (сколько всего штук взяли, купили или привезли). Третья — масса всех предметов (общий вес всего вместе).

Между ними существуют три главные формулы. Чтобы найти массу всех предметов, нужно массу одного предмета умножить на количество. Чтобы найти массу одного предмета, нужно массу всех предметов разделить на количество. ",,ru,https://stepik.org/course/288295
288293,Урок 19. Задачи на нахождение четвёртого пропорционального,"Это задачи, в которых по трём известным числам находят четвёртое. Главный признак — одинаковые предметы или величины (цена, скорость, расход). Ключевые слова: «такие же», «одинаковые», «с той же скоростью». Алгоритм: сначала делением узнаём значение для одного предмета, затем умножением — для нового количества. Пример: 4 тетради стоят 48 рублей. Сколько стоят 7? Решение: 48 : 4 = 12 руб. (одна тетрадь), 12 × 7 = 84 руб. Такие задачи развивают логику и готовят к пропорциям в старших классах.",,ru,https://stepik.org/course/288293
288292,Четные и нечетные числа,"🦉 Здравствуйте, ребята! Данный курс служит дополнением к теме ""Четные и нечетные числа. Таблица умножения и деления с числом 2.

",,ru,https://stepik.org/course/288292
288291,"Связь между величинами: цена, количество, стоимость. Решение зад","Меня зовут Совёнок, и я буду твоим помощником в этом увлекательном путешествии по математике. Вместе мы узнаем, что такое умножение и деление, научимся решать задачи и примеры, а ещё будем играть в игры, смотреть мультфильмы и слушать весёлые стихи!

",,ru,https://stepik.org/course/288291
288290,Обозначение геометрических фигур буквами,"Геометрические фигуры на чертеже нужно как-то различать, особенно когда их много и они похожи. Поэтому математики всего мира договорились давать фигурам имена с помощью заглавных букв латинского алфавита: A, B, C, D, E, F и другие. Точку обозначают одной буквой, например «Точка K» или «Точка M». Отрезок обозначают двумя буквами — это буквы его концов. Например, если концы отрезка подписаны буквами A и B, то отрезок называется AB или BA. Порядок букв не имеет значения, это один и тот же отрезок. ",,ru,https://stepik.org/course/288290
