id,title,description,price,language,url
289111,Libreofficw Calc - Введение,"А зачем тут делать описание, если по названию и так всё понятно, а вся информация есть в самом курсе? Ну теория тут есть по Кальку. Описание там всякое. Основы интерфейса какие-то. Даже какие-то задания странные непонятные. ОГО! Даже видео-гайд есть! Ну возможно оно всё-таки имеет смысл, надо посмотреть что там такого в этом вашем курсе. Ух ты! Так ещё и практические задания есть! Ну это мы точно проходим.",,ru,https://stepik.org/course/289111
289110,ИИ-помощник для бизнеса: освободи 3–5 часов каждый день,"Практический курс для предпринимателей без технического бэкграунда — только рабочие инструменты, готовые промпты и реальные кейсы из бизнеса",1300.00,ru,https://stepik.org/course/289110
289103,Японский язык с нуля для путешествий ,"Курс создан специально для туристов, которые хотят за 7 месяцев освоить базовый японский и чувствовать себя уверенно в поездке. Никакой академической перегрузки. Только то, что реально пригодится в отеле, ресторане, магазине и на улице.",,ru,https://stepik.org/course/289103
289097,Морфологические нормы английского языка,"Курс посвящен правилам образования и употребления грамматических форм слов английского языка. Вы изучите именные и глагольные части речи, а также разберете типичные ошибки.",,en,https://stepik.org/course/289097
289084,AI QA Start: тестирование LLM и AI-ботов на Python,"Практический курс по тестированию AI-ботов, LLM-приложений и AI-агентов с Python, pytest, promptfoo и DeepEval. Курс можно начать в mock-режиме без облачного API. ",3490.00,ru,https://stepik.org/course/289084
289083,Mommy and Me: First Words & Feelings,"Курс для мам детей 1,5–4 лет по мягкому игровому знакомству с английским языком через совместные ритуалы, движение, песни и методику TPR. За 8 недель вы научитесь использовать английский в повседневной жизни, а ребёнок — понимать и выполнять простые команды через игру и эмоциональное взаимодействие.",,en,https://stepik.org/course/289083
289080,"Информатика 7 класс, ""Всемирная паутина""","Курс «Информатика 7 класс. Всемирная паутина» знакомит обучающихся с основными понятиями WWW. В ходе курса рассматриваются web-страницы, сайты, гиперссылки, браузеры, поисковые системы и поисковые запросы. Обучающиеся научатся находить информацию в Интернете, правильно составлять запросы и выбирать полезные образовательные сайты для учёбы.",,ru,https://stepik.org/course/289080
289071,Machine Learning для самых маленьких,"Курс дает практические основы машинного обучения.
",,ru,https://stepik.org/course/289071
289070,«Гражданское право: сделки и договоры в профессиональной деятель,"Курс формирует базовые компетенции в области гражданско-правовых сделок и договоров для будущих специалистов государственного и муниципального управления. Разбираются понятие, признаки, классификация сделок, условия действительности, недействительность, порядок заключения договоров и ответственность. Упор на практические казусы из сферы госзакупок и работы с обращениями.",,ru,https://stepik.org/course/289070
289069,Easy English,"Мини-курс по основам лексики и грамматики английского для взрослых без знания языка. 4 блока с теорией и практикой и итоговое задание!
",,ru,https://stepik.org/course/289069
289065,Java. Подготовка к собеседованию: Коллекции и Дженерики,"🎯 Продвинутый курс‑тренажёр для разработчиков уровня Middle и выше.
Перестаньте бояться секции Collections/Generics на техническом собеседовании.

📚 Что разбираем:
• Внутреннее устройство HashMap, TreeMap, LinkedHashMap
• Контракты equals/hashCode и compareTo
• Fail‑fast и fail‑safe коллекции
• Wildcards, PECS и стирание типов
• Code Review production‑кода и mock‑интервью

💬 Все вопросы, задачи и разборы основаны на реальных собеседованиях (EPAM, Т1 и компании того же уровня).",,ru,https://stepik.org/course/289065
289061,Подготовка к тестовому туру ВсОШ по истории,"Привет! Меня зовут Артём, я сам в свое время прошел через олимпиады и знаю, как обидно терять баллы на простых ошибках. Поэтому мы будем не просто «учить даты», а тренировать особое олимпиадное мышление. Поехали!",,ru,https://stepik.org/course/289061
289059,"Эмоциональная регуляция: как управлять чувствами, не подавляя их","9 уроков об эмоциональной регуляции: как не подавлять чувства, но и не разрушаться от них. Дыхание, переоценка, дневник эмоций и STOP-правило.",,ru,https://stepik.org/course/289059
289058,Упражнения на постановку руки-фортепиано.,"Курс посвящён основам правильной постановки рук при игре на фортепиано.
Он создан для начинающих музыкантов, любителей и всех, кто хочет играть свободно, красиво и без лишнего напряжения.

В уроках подробно разбираются:

* правильная посадка за инструментом;
* положение кисти, пальцев и запястья;
* развитие естественных движений рук;
* упражнения для свободы и координации;
* формирование удобных игровых навыков с первых занятий.

Особое внимание уделяется практическим упражнениям, которые помогают почувство",,ru,https://stepik.org/course/289058
289056,Траектория без стресса: тайм-менеджмент и эффективное обучение,"Практический курс по тайм-менеджменту, эффективному обучению и управлению стрессом для тех, кто хочет учиться лучше, а не больше.
",,ru,https://stepik.org/course/289056
289044,Как подписать договор удаленно? Виды ЭП. Сфера применения ЭП.,"Курс посвящён основам электронной подписи, её видам, сфере применения и правилам использования для удалённого подписания документов. Вы узнаете, как выбрать подходящий вид электронной подписи, оформить её и использовать в бизнесе и повседневной жизни.",,ru,https://stepik.org/course/289044
289040,Код и Интерфейс: Мастерская приложений на Python,"GUI Pro: От идеи к приложению на Python и PySide6. Освойте создание профессиональных кроссплатформенных настольных приложений с помощью Python и PySide6 — официальной привязки к мощному фреймворку Qt. На курсе вы научитесь проектировать и реализовывать интерактивные графические интерфейсы, используя как код, так и визуальный редактор Qt Designer.  К концу курса вы сможете превратить любую идею в полноценное, отзывчивое и визуально привлекательное настольное приложение, написанное в «питоническом» стиле.",,ru,https://stepik.org/course/289040
289038,Сам себе мастер маникюра ,"Добро пожаловать на курс Сам себе мастер маникюра
Привет! Меня зовут Сувд-Эрдэнэ.✮ ⋆ 
Этот курс я придумала, потому что сама прошла через всё то, о чём ты, скорее всего, знаешь не понаслышке:запись в салон за две недели вперёд, лак, который облезает на третий день, дорогие мастера с непредсказуемым результатом. В какой то момент я решила разобраться, как это работает, и оказалось, что маникюр дома можно делать лучше, чем во многих салонах.И этот курс посвящен тому чтобы научить и вас сделать маникюр самой.",,ru,https://stepik.org/course/289038
289035,Предложения с однородными членами: вредные знаки препинания,"Курс для ребят, который помогает разобраться с постановкой запятых при однородных членах предложения. Он сочетает в себе теоретические материалы и практические задания. После прохождения участники смогут правильно расставлять знаки препинания и повысить свою успеваемость.",,ru,https://stepik.org/course/289035
289030,"Тревога, которая не отпускает","Практический курс о том, как заменить тревожные мысли на спокойные и реалистичные. 80 пар фраз, 8 категорий тревожного мышления, 14 дней практики — и внутренний голос, который перестаёт держать вас в постоянном напряжении. Без советов «думай позитивно» — только конкретные формулировки на замену. Научная основа — когнитивная модель тревоги Аарона Бека и Дэвида Кларка и протокол дистресс-толерантности Марши Линехан (ДБТ).",1750.00,ru,https://stepik.org/course/289030
289028,Математика в уме для жизни и учебы,"Быстро считать в уме не только может оказаться полезным, ведь вполне реально научиться считать быстрее, чем человек достанет телефон и введет вопрос, но и также является интересной гонкой против самого себя",,ru,https://stepik.org/course/289028
289019,НДС для упрощенцев,"Полный практический курс для бизнеса на УСН, который с 2026 года стал плательщиком НДС. Пошаговый разбор: как выбрать выгодную ставку (22%, 5% или 7%), считать налог, оформлять счета-фактуры, настраивать 1С и кассу. Отдельный блок — что делать со старыми договорами и как не потерять деньги. Только практика, примеры и чек-листы.",500.00,ru,https://stepik.org/course/289019
289007,История Субботников: Иудействующие России,"Этот курс — первый систематический разбор феномена русских субботников: от гонимых крестьян, принявших иудаизм, до их уникальной веры, сочетающей Тору и почитание Иисуса как Мессии. Вы узнаете, как русские люди становились евреями, чем субботники отличались от молокан и адвентистов, как их преследовало государство и почему они до сих пор остаются «забытым народом» в истории.",,ru,https://stepik.org/course/289007
289005,"Мастерство кинописателя: создай мир, который купят","- Цель курса: Сформировать у слушателей целостное представление о кинодраматургии как о практическом ремесле создания историй для экрана и дать им базовые инструменты для самостоятельной разработки сценарных проектов.
- Задачи курса:
Теоретическая: Изучить основные категории и понятия кинодраматургии (вид/жанр, фабула/сюжет/композиция, персонаж/конфликт).
Аналитическая: Научить анализировать фильмы и сценарии с точки зрения их структуры и драматургических приемов.

",5000.00,ru,https://stepik.org/course/289005
289000,Магия языка: секреты полиглотов 1,"Хотите разгадать тайны языка и понять, как он влияет на наше восприятие мира? Наш курс для школьников ""Магия языка: Погружение в мир лингвистики"" откроет перед вами увлекательный мир лингвистики, сделает изучение языка захватывающим и понятным! Курс задуман как подготовительный этап к олимпиадному курсу по лингвистике.",,ru,https://stepik.org/course/289000
288993,Асинхронные двигатели,"Курс посвящен асинхронным двигателям - самым массовым электрическим машинам в промышленности и быту. Вы разберетесь, как устроен двигатель с короткозамкнутым и фазным ротором, почему он ""асинхронный"" и как управлять его скоростью. Вместо сложных выводов - акцент на физику процессов, схемы включения и практические режимы работы.",,ru,https://stepik.org/course/288993
288992,Трансформаторы,,,ru,https://stepik.org/course/288992
288987,Go — базовый уровень,"Базовый курс Go: синтаксис, коллекции, функции, ошибки, структуры, пакеты и итоговый CLI-проект. Цели по SMART, результаты по таксономии Блума–Андерсона.",,ru,https://stepik.org/course/288987
288979,Обработка текста с помощью регулярных выражений,"Курс посвящен изучению регулярных выражений и их применению для обработки текста в Python. Участники могут познакомиться с базовыми конструкциями регулярных выражений: специальными символами, классами символов, квантификаторами, группировкой и альтернативами, а затем они научиться использовать модуль re в Python для поиска, извлечения и замены текстовых фрагментов.",,ru,https://stepik.org/course/288979
288968,Лексическое значение слова. Однозначные и многозначные слова. ,"Здесь вы можете пройти изучение тему ""Лексическое значение слова. Однозначные и многозначные слова"". Удачи!",,ru,https://stepik.org/course/288968
288948,Java для начинающих: с нуля до массивов,"Бесплатный курс для абсолютных новичков. Освоим переменные, операторы, условия, циклы и массивы. Автоматическая проверка задач. Заложи прочный фундамент в Java.",,ru,https://stepik.org/course/288948
288947,Pandas для собеседований: 50 задач уровня junior+/middle,"Практический тренажёр по Pandas для подготовки к Junior Data Analyst / Data Scientist собеседованиям. Внутри - 50 задач с реальных interview scenarios: фильтрация, groupby, merge, datetime, продуктовые mini-cases и работа с данными в стиле аналитических команд.",390.00,ru,https://stepik.org/course/288947
288942,Менеджер отдела продаж 5 дней,"За 5 дней дней менеджер должен научиться:
понимать продукты компании
правильно принимать входящую заявку
квалифицировать клиента 
объяснять ценность работ
называть предварительную вилку цены
работать с возражениями
доводить клиента до замера, консультации и КП
вести сделку в црм",,ru,https://stepik.org/course/288942
288935,Электрические цепи постоянного тока,"Данный курс направлен на изучение электрических цепей постоянного тока. Курс содержит теоретические материалы, интерактивные теоретические материалы, интерактивные практические задания и тестовые задания.",,ru,https://stepik.org/course/288935
288934,"Психология труда, инж. психология и когнитивная эргономика(ч. 2)","Актуальность данного учебного электронного курса определяется необходимостью усвоения общих и теоретических знаний, посвященных изучению профессиональной деятельности, деятельности представителей опасных профессий, осуществляемых в особых и экстремальных условиях, эффективного управления, развития личности как профессионала, а также психологии творчества и субъектов творческого труда",,ru,https://stepik.org/course/288934
288930,Правила волейбола для 6 класса,"Краткий теоретический курс по основным правилам игры в волейбол: подача, переходы, аут, начисление очков».",,ru,https://stepik.org/course/288930
288922,Как делать переложение для семиструнной гитары ,Данный курс предназначен для любителей и профессионалов играющих на гитаре. Для приобретения знаний о переложении произведений на семиструнную гитару. ,,ru,https://stepik.org/course/288922
288921,"РИЛС-ПРАКТИКУМ ""Я-КОНЦЕПЦИЯ""","6-недельный онлайн-курс по созданию reels и развитию авторского стиля в соцсетях для творческих девушек. Участницы научатся снимать и монтировать короткие видео, выстраивать визуальный язык блога, работать со смыслами, регулярно создавать контент и продвигать свои reels. В процессе обучения ученицы будут получать теорию и практические задания, тестировать разные форматы контента и постепенно формировать собственную узнаваемую подачу в блоге.",,ru,https://stepik.org/course/288921
288911,Потешки и прибаутки,"Обобщённый план курса из серии занятий по теме «Потешки и прибаутки» в рамках литературного чтения в начальной школе (2 класс). Курс направлен на развитие речи, образного мышления и знакомство с фольклором.",,ru,https://stepik.org/course/288911
288901,HSK2. Урок 1-3,"HSK2, уроки 1 [2 и 3 в разработке]. 
12 новых слов, 4 текста, грамматика и интерактивные задания. 
Для тех, кто уже знает базу HSK1. 
Красочные слайды, анимация черт и живые примеры в каждом уроке.",,ru,https://stepik.org/course/288901
288891, Становление французского символизма,"Погрузитесь в эпоху конца XIX века, когда поэзия перестала быть просто отражением реальности и стала искусством намёков, музыки и символов. Этот курс посвящён становлению французского символизма — направления, которое навсегда изменило мировую литературу. На примере творчества трёх великих поэтов вы узнаете, как формировалась новая эстетика: Шарль Бодлер — предтеча символизма, открывший «сплин» большого города и теорию соответствий; Поль Верлен — мастер музыкальности стиха, провозгласивший принцип «Музыка п",,ru,https://stepik.org/course/288891
