id,title,description,price,language,url
289649,Golang: 1046 реальных задач с собесов,to be updated,100.00,ru,https://stepik.org/course/289649
289616,Онлайн-академия преподавателей,"Здесь вы можете ознакомиться с материалами и проверить свои знания. Этот курс будет вам очень полезен, так как благодаря нему вы сможете работать",,ru,https://stepik.org/course/289616
289586,'Основы Python: первые шаги,"Курс «Основы Python для новичков» — ваш легкий старт в программировании. Python — самый популярный и понятный язык в мире, который используют в веб-разработке, анализе данных и создании нейросетей.Курс создан для абсолютных новичков без опыта в IT. Обучение построено на практике: минимум скучной теории и максимум реальных задач. Благодаря автоматическому тренажеру Stepik, вы будете писать код прямо в браузере и мгновенно получать проверку. Вы освоите синтаксис, переменные, циклы и списки. Начните учиться.",,ru,https://stepik.org/course/289586
289576,Интерактивный лабораторный практикум по VR,"Интерактивный лабораторный практикум представляет собой цикл из шести занятий, ориентированный на поэтапное освоение среды Varwin Education, а также визуального программирования интерактивного поведения объектов в виртуальной реальности.",,ru,https://stepik.org/course/289576
289575,Meme English: учись с юмором,"Hey, buddy! 👋
Этот курс — Memes English: учим английский через мемы, рилсы, TikTok, стендапы и интернет-сленг. Забудь скучные учебники — здесь реальный английский, как его используют в интернете",,ru,https://stepik.org/course/289575
289562,Проектирование ЦОР в деятельности инструктора по физической куль,"Курс знакомит с проектированием цифрового образовательного ресурса (ЦОР) для диагностики, планирования и анализа физического развития дошкольников. Вы изучите три блока: диагностический (тесты, видеофиксация), контентный (библиотека упражнений) и аналитический (автоотчеты). Практический результат — готовый прототип ЦОР для работы с детьми 3–7 лет.",,ru,https://stepik.org/course/289562
289559,Поэтика заглавий,"Курс познакомит вас с поэтикой заглавий: вы узнаете, как название из простой «шапки» превратилось в мощный литературный инструмент, научитесь различать типы заглавий (символы, цитаты, жанровые и описательные) и анализировать их функции.",,ru,https://stepik.org/course/289559
289534,Репост как правонарушение,"Курс о том, как обычный репост в соцсети может привести к штрафу или уголовному делу. Вы узнаете, чем репост отличается от личного мнения, какие статьи закона за него наказывают, и как быстро оценить риск. Минимум воды — только нужная информация и примеры.",,ru,https://stepik.org/course/289534
289522,Основы информационной безопасности для начинающих,"По окончании курса слушатель будет обладать базовыми навыками защиты личных данных и учётных записей, а также сможет уверенно использовать основные инструменты и методы информационной безопасности при работе в интернете.",,ru,https://stepik.org/course/289522
289516,Базовое обучение TRAFFIC,"Обучение составлено для сотрудников компании Traffic. Не является коммерческим продуктом, используется строго для внутреннего обучения",,ru,https://stepik.org/course/289516
289494,Фундамент DevOps,"Этот пакет курсов шаг за шагом проведёт вас через ключевые концепции Devops, начиная с самых основ. Всё доступно, наглядно и с практикой.",7990.00,ru,https://stepik.org/course/289494
289489,Python: Антикризисный FastAPI,"Пишем полноценный REST API на FastAPI — от приложения в один файл до production-ready сервиса с базой данных, авторизацией, тестами и хранилищем файлов. Один коммит — один шаг: видно, как сервис растёт строчка за строчкой, на реальном проекте, а не на очередном «Hello World». Курс для тех, кто уже знает базу Python и хочет наконец написать что-то серьёзное",2990.00,ru,https://stepik.org/course/289489
289484,«Китайский за месяц: с нуля до первого диалога»,"
Мечтаете заговорить на китайском, но думаете, что это сложно? Докажем обратное за 30 дней. Я - Кибизова Диана. Ваш учитель и наставник. Начнем вместе !",,ru,https://stepik.org/course/289484
289479,"«Атом, молекула, организм: Кадр, эпизод, сцена»","Цель курса: Научить участников сознательно выстраивать повествование от микро- к макроуровню, понимая драматургическую и визуальную функцию каждого элемента. Слушатель научится «читать» фильм как текст, составленный из осмысленных предложений (сцен), которые, в свою очередь, состоят из слов (эпизодов) и букв (кадров).",100.00,ru,https://stepik.org/course/289479
289476,10 уникальных вариантов ЕГЭ по математике,"Это не цельный курс, здесь нет обучающих видео, теории и примеров. Зато есть 10 уникальных вариантов ЕГЭ с со свежими, авторскими задачами. Отличный способ устроить себе полноценные пробники! 

​​​​​​​Первая часть — из открытого банка, а многие задания второй части — авторские и, как правило, сложнее экзаменационных. В особенности алгебраические (13 и 15). Ответы вы можете удобно сверять на платформе и оценивать результат в баллах. А решения заданий второй части публикую в текстовом формате (PDF).",700.00,ru,https://stepik.org/course/289476
289475,"КУРС: «ФОП ДО: от СанПиН к развитию личности"".","Основные понятия для усвоения:

ФОП ДО - федеральная образовательная программа дошкольного образования – единый для всей РФ базовый объём и содержание ДО.
Целевые ориентиры - социально-нормативные возрастные характеристики возможных достижений ребёнка (не подлежат непосредственной оценке).
Педагогическая диагностика - наблюдение за деятельностью ребёнком для индивидуализации образования (без аттестации).
Культурные практики - ситуации, в которых ребёнок проявляет самостоятельность и творчество.",,ru,https://stepik.org/course/289475
289449,Методы лингвистических исследований,Курс разработан преподавателями кафедры иностранных языков №3 РЭУ им. Г.В. Плеханова для ознакомления студентов лингвистических специальностей и направлений с основами научной деятельности ,,ru,https://stepik.org/course/289449
289399,Kotlin для новичков,"Курс Kotlin для начинающих: синтаксис, типы, null-safety, ООП, корутины, коллекции. Теория, разбор примеров и задачи с автопроверкой.",990.00,ru,https://stepik.org/course/289399
289398,JavaScript для новичков,"Курс современного JavaScript: переменные, типы, функции, объекты, DOM, асинхронность, модули. Теория, разбор примеров и задачи с автопроверкой.",990.00,ru,https://stepik.org/course/289398
289397,C++ для новичков,"Современный C++ для начинающих: синтаксис, типы, указатели, ссылки, классы, STL, шаблоны. Теория, разбор примеров, задачи с автопроверкой.",990.00,ru,https://stepik.org/course/289397
289396,C# для новичков,"Курс C# для начинающих: синтаксис, типы, ООП, исключения, коллекции и LINQ. Теория, примеры и задачи с автопроверкой на .NET.",990.00,ru,https://stepik.org/course/289396
289395,Python для новичков,"Полный курс Python для начинающих. От синтаксиса и переменных — до ООП, исключений и работы с файлами. Теория, примеры, задачи с автопроверкой.",990.00,ru,https://stepik.org/course/289395
289391,«Апгрейд кружка»: как сделать программу видимой и продаваемой,"У вас хороший кружок. Дети занимаются с удовольствием. Родители, которые пришли — довольны. Но новых почему-то нет. Или приходят и уходят. Или сразу спрашивают «а почему так дорого».

Знакомо? Тогда этот курс для вас.",,ru,https://stepik.org/course/289391
289388,Формы и элементы пользовательского интерфейса,"Веб-формы — это то, что делает сайт живым. Без них пользователь может только смотреть, но не может написать сообщение, заказать товар, зарегистрироваться или войти в аккаунт. Этот курс научит вас создавать такие формы с нуля.

Вы разберётесь, как работают все элементы пользовательского ввода: от простого текстового поля до раскрывающихся списков и многострочных комментариев. Вместе с теорией вас ждут практические задания с автоматической проверкой — вы сразу увидите свой прогресс и сможете исправить ошибки.",,ru,https://stepik.org/course/289388
289387,Числа и вычисления. Делимость,"Курс посвящен изучению делимости чисел. Курс поможет усвоению понятий: делимости чисел, деление целого числа с остатком, наибольший общий делитель, наименьшее общее кратное, простое число, составное число, числа сравнимые по данному модулю. На курсе вы научитесь применять полученные теоретические знания к решению задач, а также сможете закрепить опыт решения с помощью заданий для самостоятельной работы.",,ru,https://stepik.org/course/289387
289383,Архивация данных,"Начинающие пользователи ПК, студенты IT-специальностей, системные администраторы, все, кто хочет эффективно работать с файловыми архивами.",,ru,https://stepik.org/course/289383
289379,Курс строительного менеджера: управление проектами от А до Я  ,"Станьте профессиональным строительным менеджером с нашим курсом! Освойте все аспекты управления проектами: от планирования и документации до современных технологий и антикризисного управления.  

Вы научитесь:  

Управлять строительными проектами от А до Я.  
Составлять сметы и вести документацию.  
Применять BIM-технологии и цифровые инструменты.  
Обеспечивать безопасность на стройке.
Идеально для новичков и опытных специалистов, желающих выйти на новый уровень!  ",,ru,https://stepik.org/course/289379
289377,Жасанды Интеллект,"Курс «Жасанды интеллект» предназначен для знакомства с основами искусственного интеллекта, его возможностями и применением в современном мире. В курсе рассматриваются виды ИИ, машинное обучение, нейросети и использование ИИ в образовании и повседневной жизни.
«Жасанды интеллект» курсы студенттерге жасанды интеллекттің негізгі ұғымдарын, қолданылу салаларын және қазіргі қоғамдағы маңызын түсіндіруге арналған. Курс барысында нейрондық желілер, машиналық оқыту және цифрлық технологиялар туралы теориялық мәліме",,kk,https://stepik.org/course/289377
289374,Праздники России,"На этом курсе вы сможете узнать много интересного. Поработаете с собой, узнаете о праздниках. Удачи?!",,ru,https://stepik.org/course/289374
289365,"Лагерное пространство в романе А.Д. Синявского «Спокойной ночи""","Роман Андрея Синявского «Спокойной ночи» по праву считается ключевым автобиографическим произведением писателя, художественным итогом его сложной судьбы. ",,ru,https://stepik.org/course/289365
289360,Машинное обучение для новичков,"Полный практический курс по машинному обучению для тех, кто только начинает. От базовой математики и Python — к классическим алгоритмам, нейросетям и ML в продакшене. Теория, примеры, разбор реальных кейсов, тесты.",1990.00,ru,https://stepik.org/course/289360
289359,Машинное обучение для новичков,"Полный практический курс по машинному обучению для тех, кто только начинает. От базовой математики и Python — к классическим алгоритмам, нейросетям и ML в продакшене. Теория, примеры, разбор реальных кейсов, тесты.",,ru,https://stepik.org/course/289359
289358,Автоматизация тестирования ПО на Java. Selenium + REST Assured,"🏅 Победитель Stepik Awards в номинации ""Прорыв года""
ДОМАШНИЕ ЗАДАНИЯ ПРОВЕРЯЮТСЯ ЛИЧНО АВТОРОМ + задачи на программирование и тестов!
Данный курс подходит для тех, кто желает изучить программирование на Java, а так же освоить очень востребованную и высокооплачиваемую профессию Тестировщика-автоматизатора, используя популярные инструменты для тестирования Selenium и REST Assured! Так же он подойдет для тех кто уже работает тестировщиком или в сфере IT.",6299.00,ru,https://stepik.org/course/289358
289357,Как открыть свой первый бизнес ,"Мечтаете запустить собственное дело, но не знаете, с чего начать? Боитесь допустить ошибку на старте и потерять время и деньги? Наш курс поможет вам уверенно сделать первый шаг в предпринимательстве — от идеи до первых продаж.",,ru,https://stepik.org/course/289357
289352,Задачи Python по уровням,"Курс — коллекция задач по Python для 8–11 классов. Без теории, без лекций. Только практика.

Что внутри:
Разделение на уровни сложности: «Базовый» (алгоритмы и переменные), «Средний» (циклы, списки, функции), «Продвинутый» (вложенные структуры, срезы, генераторы, рекурсия).

Для кого:
Учитель выдаёт готовую ссылку — ученик решает в своём темпе, система проверяет сама.

Результат:
Ученик напишет 50+ программ.",,ru,https://stepik.org/course/289352
289348,Математика 5 сынып,"Ондық бөлшектерді бөлу – ондық бөлшектерді бір-біріне немесе бүтін санға бөлу амалы. Бөлу кезінде үтірге мән беріледі: егер бөлгіш ондық бөлшек болса, үтірді жойып, екі санды да бірдей 10, 100 сияқты сандарға көбейтеміз. Содан кейін кәдімгі бөлу жасалады.
",,ru,https://stepik.org/course/289348
289343,UX/UI-дизайн сайта-визитки,"Курс для начинающих под руководством арт-директора и проверкой домашних заданий.

От арт-директора:
«Привет! Я на своём проекте расскажу и покажу тебе все шаги дизайна. Но проектировать и рисовать ты будешь свой, совершенно индивидуальный дизайн, который сможешь положить себе в портфолио».",1990.00,ru,https://stepik.org/course/289343
289340,"Физкультура в школе: энергия, здоровье, успех.","Курс о том, как сделать физическую культуру любимым предметом! Школьники научатся правильно выполнять упражнения, понимать ценность движения для здоровья, работать в команде и достигать целей. Учителя и родители найдут методики мотивации детей к активному образу жизни.",,ru,https://stepik.org/course/289340
289337,Основы алгебры логики ,"Курс «Основы алгебры логики» предназначен для обучающихся 10 класса и направлен на формирование базовых знаний в области математической логики. В рамках курса рассматриваются логические операции, таблицы истинности, законы алгебры логики, логические функции и уравнения, а также их применение при решении практических задач в информатике.

",,ru,https://stepik.org/course/289337
289312,Введение в технологию Ethernet,"Курс по тематике ethernet и начала его изучения в рамках МДК 01.01 Компьютерные сети. «ПМ.01 НАСТРОЙКА СЕТЕВОЙ ИНФРАСТРУКТУРЫ» 
Тема 1.1 Введение в сетевые технологии
3. Сетевые технологии Ethernet
",,ru,https://stepik.org/course/289312
289310,Административное право,"Курс «Административное право» даёт системное представление об отрасли, регулирующей отношения в сфере государственного управления. Изучаются основы административного законодательства, статус субъектов правоотношений, механизмы регулирования и порядок привлечения к административной ответственности (в т. ч. по КоАП РФ). Предназначен для студентов юридических специальностей и госслужащих.",,ru,https://stepik.org/course/289310
289309,Китайский с нуля: тоны и приветствие,"Первый шаг в мир китайского языка. Узнайте, как работают 4 тона, научитесь правильно произносить приветствие «你好» и пройдёте интерактивные задания с автоматической проверкой. Подходит для начинающих.",,ru,https://stepik.org/course/289309
289306,English for visual communication,"Курс English for visual communication"" предназначен для студентов колледжей 1‑го курса. Программа построена по модульному принципу: каждый модуль охватывает три типа визуального контента — статичные изображения, динамические изображения и видеоматериалы. Обучение начинается с входной диагностики уровня визуальной грамотности, продолжается практическими заданиями в рамках обучающего блока и завершается контрольной диагностикой для фиксации достигнутых результатов. ",,en,https://stepik.org/course/289306
